{
  "$schema": "http://json-schema.org/draft-07/schema#",
  "title": "ExamMetadata",
  "type": "object",
  "properties": {
    "schema_version": {
      "type": "string"
    },
    "last_updated": {
      "type": "string"
    },
    "source": {
      "type": "string"
    },
    "sections": {
      "type": "array",
      "items": {
        "type": "object"
      }
    },
    "metadata": {
      "type": "object"
    }
  },
  "required": [
    "schema_version",
    "last_updated",
    "source",
    "sections"
  ]
}