{
  "schema_version": "1.0.0",
  "last_updated": "2026-06-26",
  "source": "Official GATE Organizing Committee",
  "sections": [
    {
      "title": "Standard Faq Rules",
      "content": "Template content to be populated from official GATE information brochures."
    }
  ],
  "metadata": {
    "version": "1.0",
    "status": "VALIDATED_TEMPLATE"
  }
}